{
  "case_id": "FIRE-D2-V091-COMP-001",
  "standard": "SP554_2026",
  "action": "sp554_fire_mechanical_guided",
  "member_route": "central_compression",
  "steel_strength_group": "ordinary",
  "high_strength_gost9651_qualified": false,
  "fire_resistant_gost9651_qualified": false,
  "fy_norm_n_mm2": 255.0,
  "route": {
    "N_n": 400000.0,
    "A_gross_mm2": 5282.0,
    "gamma_c": 0.9,
    "sp16_lambda_z_geom": 35.28,
    "sp16_lambda_y_geom": 119.39,
    "sp16_l_eff_z": 3000.0,
    "sp16_l_eff_y": 6000.0,
    "sp16_i_z": 85.03401360544217,
    "sp16_i_y": 50.2554652818494,
    "sp16_curve_z": "b",
    "sp16_curve_y": "c"
  }
}
